{
  "$schema": "../schemas/atlas_lens.schema.json",
  "lens_id": "LENS-CONDITION-001",
  "name": "Condition View",
  "description": "Shows project conditions and the systems and assemblies that resolve them. Primary lens for understanding what conditions exist and how the manufacturer graph addresses them.",
  "emphasized_node_classes": ["condition", "system", "assembly"],
  "displayed_relationships": ["supports", "resolved_by", "governed_by"],
  "inspection_capabilities": [
    "list_all_conditions",
    "inspect_condition_triggers",
    "view_resolving_assemblies_per_condition",
    "check_condition_grounding_status",
    "trace_condition_to_governing_rules"
  ]
}
